{"proposition":{"id":"ATP-OPS-02","subject":"retry-safety","target":"example/strong"},"signals":[{"id":"RLA-004","type":"risk-indicator","confidence":"high"}],"control_evidence":[{"id":"CTP-OPS-02","status":"present","evidence":[{"path":"src/idempotency.rs","context":"implementation","authority":"authoritative"}]}],"assurance_evidence":[{"id":"ATP-OPS-02","status":"pass","evidence":[{"path":"tests/lost_response.rs","context":"test","authority":"authoritative"}]}],"residual":{"status":"controlled","severity":"informational","reason":"The risk signal is covered by an evidenced control and passing assurance test."}}
