{"proposition":{"id":"ATP-OPS-02","subject":"retry-safety","target":"example/mature"},"signals":[{"id":"RLA-004","type":"risk-indicator","confidence":"high"}],"control_evidence":[{"id":"CTP-OPS-02","status":"present","evidence":[{"path":"src/retry.rs","context":"implementation","authority":"authoritative","assertion":"attempts are bounded"}]}],"assurance_evidence":[{"id":"ATP-OPS-02","status":"partial","evidence":[{"path":"tests/retry.rs","context":"test","authority":"supporting","assertion":"retry count tested but lost response is not"}]}],"residual":{"status":"assurance-gap","severity":"high","reason":"The control is present, but lost-response single-effect behavior is not demonstrated.","missing":["lost-response-test"]}}
